0,Celular Samsung Galaxy S10e G970f 5.8' Dual 128gb Mostruário,https://produto.mercadolivre.com.br/MLB-1811210440-iphone-7-32-gb-preto-fosco-desbloqueado-novo-nota-fiscal-_JM,Samsung,Galaxy S,S10e Duos,,128 GB,6 GB,"5.8 """,1080 px x 2280 px,Dynamic AMOLED,438 ppi,,Sim,3100 mAh,Íon de lítio,Sim,Não,,19 h,Sim,Sim,142.2 mm x 69.9 mm x 7.9 mm,Não,Sim,Sim,Não,Sim,IP68,,,8,,Sim,Sim,Sim,Sim,Sim,Sim,2,Nano-SIM,Não,150 g,Android,9.0 Pie,14,16 Mpx,3840 px x 2160 px,10 Mpx,Sim,2,16 Mpx/12 Mpx,f 2.2/f 1.5,1,3840 px x 2160 px,f 1.9,Não,,8x,4G/LTE,USB-C,Sim,Sim,Sim,Sim,Sim,Sim,Não,Sim,Não,"OLS !!! CELULAR SAMSUNG GALAXY S10E G970F - TELA INFINITY-O 5.8' DAYNAMIC AMOLED - DUAL CHIP - 128 GB - RAM 6 GB - 4G - CÂMERA 12 MP + 16 MP - ANDROID 9.0 - OCTA CORE 2.8GHz - MOSTRUÁRIO. Aparelho 100% ORIGINAL da Samsung, nacional, homologado pela Anatel, desbloqueado e sem defeito algum. Era de MOSTRUÁRIO e pode conter alguma pequena marca estética, suave, que não compromete seu funcionamento. Aparelho em EXCELENTE ESTADO estético e funcionando perfeitamente. --- CONTEÚDO DA EMBALAGEM: - 1 Aparelho Smartphone Samsung Galaxy S10E G970F; - 1 Bateria acoplada ao aparelho; - 1 Carregador Fast; - 1 Cabo USB - Tipo C; - 1 Fone de Ouvido; - 1 Ejetor de Cartão SIM. --- Não temos caixa original do produto. --- Produto reembalado com caixa da nossa empresa. Garantia de 12 meses sobre defeito de fabricação, EXCLUSIVAMENTE com a nossa empresa. //// Este modelo não é à prova d'água. //// É resistente à água e à poeira, e não há garantia se houver absorção de líquido. Neste anúncio e valor, emitimos RECIBO e TERMO DE GARANTIA ao comprador. === INFORMAÇÕES SOBRE O PRODUTO: === COMPACTO, PODEROSO E INOVADOR: Desenvolvido especialmente para aqueles que querem viver toda experiência da nova geração de celulares, mas que não abrem mão de um aparelho compacto que cabe na palma da mão, o Samsung Galaxy S10E é a solução. Com design inovador, desempenho arrojado e câmeras profissionais, ele não apenas se destaca, mas também se diferencia de tudo que já foi pensado em tecnologia para Smartphones. TELA INFINITA SEM INTERRUPÇÕES: Equipado com um display Infinity-O de 5,8 polegadas, a tela do S10E proporciona uma experiência visual única. Agora, a câmera frontal do aparelho fica escondida dentro da tela, garantindo mais espaço para você aproveitar as imagens sem distrações. Imagens cinematográficas em qualquer lugar O Galaxy S10E é o primeiro celular a lançar a tela Dynamic AMOLED, que oferece cores e contrastes incrivelmente reais em cada cena, até mesmo nas mais escuras EYE COMFORT: DESCANSO PARA A VISÃO: Também equipado com a tecnologia Eye Comfort, a tela do aparelho reduz até 42% da luz azul nociva aos olhos, sem que a qualidade da imagem seja alterada. DESBLOQUEIO LATERAL SIMPLES: Com o leitor de impressão digital foi transferido para lateral do celular, é possível desbloquear essa versão do Galaxy S10E fazendo movimentos simples e naturais com os dedos. CÂMERAS: Tire fotos profissionais utilizando todo o poder das câmeras do Galaxy S10E. Altere entre a Grande angular e a Ultra-ampla com um único clique ou consiga imagens incríveis utilizando as duas em conjunto. O S10E vem com um arsenal de lentes traseiras para você tirar fotos com a máxima qualidade em qualquer lugar. (grande-angular 12 MP [f1.5/f2.4] e ultra-ampla 16 MP [f2.2]) MODO PANORÂMICO ULTRA-AMPLO: Você não precisa mais se mover tanto para conseguir fotos panorâmicas de qualidade. A câmera grande angular garante uma cena maior em um único quadro. A câmera dianteira do Galaxy S10E foi totalmente redefinida e ganhou novas funcionalidades, como foco dinâmico, sensor de pixel duplo e gravação em 4K UHD. Pela primeira vez, uma câmera frontal supera as câmeras traseiras em um celular Samsung. Além das lentes, as câmeras do Galaxy S10E contam com recursos inteligentes2 que personificam suas fotografias antes ou depois de serem tiradas. Com poucos cliques você tira, edita e publica suas fotos nas suas redes sociais. O Samsung Galaxy S10E tem processamento arrojado para acompanhar uma geração que não pode esperar. Veja todas as possibilidades do aparelho aperfeiçoe sua rotina! COMPARTILHAMENTO DE BATERIA: Além da bateria de 3.100 mAh3, o S10E conta com a inovadora tecnologia Wireless PowerShare. Com ele, você pode carregar a bateria de outros aparelhos, usando a energia armazenada no próprio Galaxy. === CARACTERÍSTICAS DO APARELHO: === --- DADOS DO FABRICANTE: . Marca: Samsung . Modelo: SM-G970F . Nome: Smartphone Samsung Galaxy S10 E --- CHIP: . Tipo de Chip: Nano Chip . Quantidade de Chips: Dual Chip --- TELA: . Tipo de tela: Super AMOLED Dinâmica . Tamanho: Tela infinita de 5.8"" . Resolução 2280x1080 --- MEMÓRIA: . Memória RAM: 6 GB . Memória Interna: 128 GB . Memória expansível até 1 TB com Cartão MicroSD - Não Incluso - Compartilha a gaveta do SIM. --- PROCESSADOR: . Processador Octa-Core 2.8GHz (Quad 2.8GHz + Quad 1.7GHz) --- SISTEMA OPERACIONAL: . Android 9.0 --- CÂMERAS: . Câmera Traseira Dupla: 12 MP, f/1.5-2.4, 26mm (wide), 1/2.55"", 1.4µm, PDAF Dual Pixel , estabilização óptica + 16 MP, f/2.2, 12mm (ultrawide), 1.0µm . Gravação de vídeo: 2160p@60fps, 1080p@240fps, 720p@960fps, HDR . Flash: Flash LED duplo . Auto HDR . Câmera Frontal: 10 MP, f/1.9, 26mm (wide), 1.22µm, PDAF Dual Pixel . Gravação de Vídeo: 2160p@30fps, 1080p@30fps . Auto HDR --- CONECTIVIDADE: . 4G . Bluetooth Versão 5.0 com A2DP/LE . Wi-Fi 802.11 a/b/g/n/ac + MIMO (2.4Ghz/5Ghz) . WiFi direct, hotspot . NFC . Quick Charge 4.0 . Samsung DeX (Desktop experience) . Samsung Pay . GPS: A-GPS, GeoTagging, GLONASS, GALILEO, BeiDou . Saída para áudio: Plug 3.5mm P2 . USB: USB 3.1 Type-C, USB OTG On-The-Go . Saída para TV: Não Suporta . IrDA infravermelho: Não suporta --- MULTIMÍDIA: . Rádio: Não suporta . TV : Não suporta . Formatos de vídeo: MP4, H.265, H.264, H.263, DivX, XviD . Formatos de áudio: MP3, OGG, eAAC+, FLAC . 32-bit/384kHz audio --- RECURSOS: . Mensagens: SMS (T9), MMS, E-mail, Push mail . Viva voz . Video chamada . Controle de chamada: Discagem de voz, Gravador de voz, Comando de voz . Redutor de ruído . Vibração . Toques / ringtones: Polifônicos e personalizados . Navegador web: HTML, XHTML, HTML5 --- BANDA: . 2G GSM (GPRS/EDGE) 850, 900, 1800, 1900 MHz . 3G Bandas B1(2100),B2(1900),B4(AWS),B5(850),B8(900) 3G Downlink / Uplink HSPA+ 42.2 / 5.76 Mbps . 4G Bandas 1(2100), B2(1900), B3(1800), B4(AWS), B5(850), B7(2600), B8(900), B12(700), B13(700), B17(700), B18(800), B19(800), B20(800), B25(1900), B26(800), B28(700), B32(1500), B66(AWS-3) 4G categoria Cat. 9"" -- SENSORES: . Acelerômetro . Proximidade . Bússola . Luminosidade . Giroscópio . Barômetro . Leitor de íris . Monitor cardíaco . SpO2 . Efeito Hall . Reconhecimento facial (desbloqueio) . Sensor de impressão digital (na traseira) --- DIMENSÕES: . Dimensões: 69,9 x 142,2 milímetros . Peso: 150 gramas --- ALIMENTAÇÃO: . Tipo de bateria: Li-Ion (Fixa) . Ampére da bateria: 3100 mAh *********************************************************** ........ COMPRA CONSCIENTE E SEGURA: ........ *********************************************************** - O frete é oferecido pelo Mercado Livre e as opções estão disponíveis ao comprador, no ato da compra. - Decida com segurança ANTES da compra. Após, não tem como mudar. - A entrega será realizada apenas ao endereço que está em seu cadastro do Mercado Livre. - O produto é coletado em nossa empresa, de segunda a sexta, após às 12h, pela empresa (Correios ou Transportadora) CONTRATADA pelo Mercado Livre. - Em geral, até o dia útil seguinte, o Mercado Livre informa o código de rastreamento para acompanhamento da entrega do produto. - Após a coleta, a nossa empresa não tem qualquer forma de acesso ao processo de entrega do produto. - Se houver extravio, o Mercado Livre indeniza comprador e vendedor. - Ao receber o produto, NÃO ACEITE SE A EMBALAGEM ESTIVER VIOLADA. - Nossas embalagens são protegidas com saco plástico e fita invioláveis. - E se o produto apresentar algum problema, NÃO ABRA RECLAMAÇÃO NO MERCADO LIVRE!!! --- Envie-nos uma mensagem pelo Mercado Livre que rapidamente resolveremos o seu problema. - O horário de atendimento de nossa empresa é de segunda a sexta-feira, das 09h às 18h. Não temos expediente aos sábados, domingos e feriados. Agradecemos a preferência e ficamos à disposição. OLS !!!",Sim,,,2019,MicroSD,512 GB,Full HD+,Infinity-O Display,19.5 - 9,,,,"Scene Optimizer,Shot suggestions,Flaw Detection,Food,Panorama,Pro,Live focus with bokeh effect,Photo,Video,Super Slow-mo,Slow motion,Hyperlapse",Sim,One UI,,,,Não,,,Sim,Desbloqueado,,,,,,,,,,,,,
0,Moto E6s (2020) Dual Sim 64 Gb Vermelho-magenta 4 Gb Ram,https://produto.mercadolivre.com.br/MLB-1811210440-iphone-7-32-gb-preto-fosco-desbloqueado-novo-nota-fiscal-_JM,Motorola,Moto E,E6s (2020) Dual SIM,,64 GB,4 GB,"6.1 """,720 px x 1560 px,IPS,282 ppi,500 cd/m²,Sim,3000 mAh,Polímero de lítio,Não,Sim,,,Sim,,155.6 mm x 73 mm x 8.5 mm,Não,Sim,Não,Não,Sim,IP67,MediaTek MT6762 Helio P22,8x2 GHz Cortex-A53,8,2 GHz,Sim,Sim,,Não,Não,Sim,2,Nano-SIM,Não,160 g,Android,9.0 Pie,,13 Mpx,1920 px x 1080 px,5 Mpx,Sim,2,13 Mpx/2 Mpx,f 2.2/f 2.4,1,1920 px x 1080 px,f 2.2,Não,,,4G/LTE,Micro USB,Sim,Sim,Sim,Sim,Sim,Não,Não,Sim,Não,"Inteligente e preditivo O Motorola E6s (2020) Dual SIM tem o sistema operacional avançado Android9.0 Pie que aprende seus hábitos para se adaptar à sua rotina e alcançar a máxima eficiência de sua equipe. Essa tecnologia torna seu dispositivo tão autônomo que pode reduzir o consumo de energia, ajustar automaticamente o brilho e gerenciar a bateria de forma inteligente. Câmera dupla e mais detalhes Suas 2 câmeras traseiras de 13 Mpx/2 Mpx permitirão que você tire fotos mais detalhadas e obtenha efeitos únicos, como a famosa profundidade rasa do modo retrato de campo. Além disso, o dispositivo possui uma câmera frontal de 5 Mpx para que você possa tirar selfies divertidas ou fazer videochamadas. Mais para ver Com sua tela IPS de 6.1 "", desfrute de cores intensas e maior clareza em todo o seu conteúdo. Desbloqueio rápido com sua impressão digital Com o sensor de impressão digital, o acesso é seguro e você poderá desbloqueá-lo automaticamente com um toque. Bateria o dia todo Sua bateria 3000 mAh se adapta ao seu estilo de vida e lhe garante energia durante um dia inteiro com uma única carga. Grande capacidade de armazenamento Com sua memória interna de 64 GB você sempre terá espaço para armazenar arquivos e documentos importantes. Além disso, você poderá salvar filmes, séries e vídeos para reproduzi-los sempre que quiser offline.",Sim,,,2020,MicroSD,256 GB,,,,,IMG GE8320,650 MHz,,,,Não,,,Não,,,Sim,Desbloqueado,,,,,,,,,,,,,
0,Smartphone Samsung Galaxy A10s Dual Sim 32gb Interna 2gb Ram,https://produto.mercadolivre.com.br/MLB-1811210440-iphone-7-32-gb-preto-fosco-desbloqueado-novo-nota-fiscal-_JM,Samsung,Galaxy A,A10s Duos,,32 GB,2 GB,"6.2 """,720 px x 1520 px,PLS,271 ppi,500 cd/m²,Sim,4000 mAh,Polímero de lítio,Não,Não,,,Sim,Sim,156.9 mm x 75.8 mm x 7.8 mm,Não,Não,Não,Não,Não,IP68,MediaTek MT6762 Helio P22,"4x2 GHz Cortex-A53,4x1.5 GHz Cortex-A53",8,2 GHz,Sim,Sim,Não,,Não,Sim,2,Nano-SIM,Não,168 g,Android,9.0 Pie,10,13 Mpx,1920 px x 1080 px,8 Mpx,Sim,2,13 Mpx/2 Mpx,f 1.8/f 2.4,1,1920 px x 1080 px,f 2.0,Não,,4x,4G/LTE,Micro USB,Sim,Sim,Sim,Sim,Sim,Não,Não,Sim,Não,"Smartphone Samsung Galaxy A10s Preto 32GB Aproveite a tela HD+ de 6,2 polegadas para assistir aos seus conteúdos no favoritos. Mergulhe na cena dos seus programas de comédia ou na ação dos seus jogos com o Display Infinito do Galaxy A10s. Caracteristicas: Design confortável e elegante O Galaxy A10s possui design confortável que e se encaixa perfeitamente em suas mãos. O acabamento elegante e moderno se destaca, e você ainda pode escolher entre as cores preta, azul ou vermelha. Para desbloqueá-lo, basta posicionar o seu dedo no leitor de digital na parte de trás. Duas câmeras para capturar o momento Aponte e toque para capturar fotos claras e nítidas com a câmera dupla do Galaxy A10s. O conjunto de câmeras de profundidade é ideal para fotografar. Abuse da sua criatividade enquanto tira as fotos. Foque no que é importante A avançada câmera de profundidade do Galaxy A10s permite que você ajuste a profundidade de campo antes e depois de tirar a foto. Tire fotos mais profissionais eliminando distrações de fundo e foque no que é importante. Tire selfies incríveis O foco está em você, e é sua hora de brilhar. Tire suas melhores selfies com a câmera frontal de 8 MP do Galaxy A10s. O Foco Dinâmico também desfoca o fundo suavemente para sua personalidade ser a estrela da foto. Mais bateria para o seu dia Você faz muita coisa no dia a dia, então faça em um celular capaz de acompanhar seu ritmo. Use a bateria de 4.000mAh do Galaxy A10s para jogar, assitir filmes, séries e transmissões ao vivo, e fazer o que ama em um celular capaz de acompanhar seu ritmo. Proteção na ponta do seu dedo Simplifique o acesso móvel com uma segurança confiável. O Galaxy A10s oferece um leitor de impressão digital na parte posterior para você acessar aplicativos suportados e desbloquear o dispositivo facilmente. Proteção personalizada Agora, você pode desbloquear seu celular instantaneamente apenas segurando-o em frente ao seu rosto. A tecnologia de reconhecimento facial permite que apenas você acesse o dispositivo, garantindo que seus dados não caiam nas mãos erradas. Conteudo da embalagem: - 1 Smartphone Samsung Galaxy A10s - Manual de instruções - Carregador - Cabo USB - Fone de ouvido - Garantia: 12 meses",Sim,,Agosto,2019,MicroSD,512 GB,HD+,Infinity-V Display,19 - 9,60 Hz,PowerVR GE8320,650 MHz,"LED flash,Autofocus,Touch focus,EIS,Face detection,Smile detection,HDR",,One UI,,MIUI 12,Não,,,,Sim,Desbloqueado,,,,,,,,,,,,,
0,Xiaomi Poco X3 Nfc Shandow Grey 64 Gb 6 Gb De Ram,https://produto.mercadolivre.com.br/MLB-1811210440-iphone-7-32-gb-preto-fosco-desbloqueado-novo-nota-fiscal-_JM,Xiaomi,,Poco X3 NFC,,64 GB,6 GB,"6.67 """,1080 px x 2400 px,IPS,395 ppi,450 cd/m²,Sim,5160 mAh,Polímero de lítio,Não,Não,,,Sim,Sim,165.3 mm x 76.8 mm x 9.4 mm,Não,Sim,,,Não,IP53,Snapdragon 732G,"2x2.3 GHz Kryo 470 Gold,6x1.8 GHz Kryo 470 Silver",8,2.3 GHz,Sim,Sim,Sim,Sim,Não,Sim,2,Nano-SIM,,215 g,Android,10,,64 Mpx,3840 px x 2160 px,20 Mpx,Sim,4,64 Mpx/13 Mpx/2 Mpx/2 Mpx,f 1.89/f 2.2/f 2.4/f 2.4,1,1920 px x 1080 px,f 2.2,Não,,10x,4G/LTE,USB-C,Sim,Sim,Sim,Sim,Sim,Sim,,Sim,,Celular com apenas 2 semanas de uso (caixa do aparelho nota fiscal carregador original) ótimo aparelho,Sim,,Setembro,2020,MicroSD,256 GB,Full HD+,DotDisplay,20 - 9,,Adreno 618,800 MHz,,,MIUI 12,,MIUI 12,,,,,Sim,Desbloqueado,,,,,,,,,,,,,
0,Celular S20 Plus Tela 6.7  128 Gb 8gb Octa Core Mostruario,https://produto.mercadolivre.com.br/MLB-1811282897-iphone-12-pro-max-_JM,Samsung,Galaxy S,S20+ Duos,,128 GB,8 GB,"6.7 """,1440 px x 3200 px,Dynamic AMOLED 2X,525 ppi,,Sim,4500 mAh,Polímero de lítio,Sim,Não,,23 h,Sim,Sim,161.9 mm x 73.7 mm x 7.8 mm,Não,Sim,Sim,Não,Sim,IP68,Exynos 990,"2x2.73 GHz Mongoose M5,2x2.5 GHz Cortex-A76,4x2 GHz Cortex-A55",8,2.73 GHz,Sim,Sim,Sim,Sim,Sim,Sim,2,Nano-SIM,Sim,186 g,Android,10,14,64 Mpx,7680 px x 4320 px,10 Mpx,Sim,4,64 Mpx/12 Mpx/12 Mpx/0.3 Mpx,f 2.0/f 1.8/f 2.2/f 1.0,1,3840 px x 2160 px,f 2.2,Não,,30x,4G/LTE,USB-C,Sim,Não,Sim,Sim,Sim,Sim,Não,Sim,Não,"K2X !!! CELULAR SAMSUNG S20 PLUS SM G985F - TELA 6.7” - DUAL CHIP 4G LTE – ROM 128GB - RAM 8 GB - OCTA-CORE - ANDROID 10 – MOSTRUARIO. Aparelho 100% ORIGINAL da SAMSUNG, nacional, homologado pela Anatel, desbloqueado e sem defeito algum. Era de MOSTRUÁRIO e pode conter marcas, suave, que não compromete seu funcionamento. Aparelho em EXCELENTE ESTADO de conservação, devidamente testado, higienizado e funcionando perfeitamente. --- CONTEÚDO DA EMBALAGEM: - 01 Aparelho SAMSUNG S20 PLUS c/ bateria; - 01 Carregador; - 01 Cabo USB; - 01 Fone de Ouvidos; - 01 Ejetor de Chips. - 01 Capa Protetora. --- Não temos caixa original do produto. --- Produto reembalado com caixa da nossa empresa. Garantia de 12 meses sobre defeito de fabricação, exclusivamente com nossa empresa. Neste anúncio e valor, emitimos RECIBO e TERMO DE GARANTIA ao comprador. ==== INFORMAÇÕES SOBRE O PRODUTO: === O Samsung Galaxy S20 Plus é um smartphone Android com características inovadoras que o tornam uma excelente opção para qualquer tipo de utilização, representando um dos melhores dispositivos móveis já feitos. A tela de 6.7 polegadas coloca esse Samsung no topo de sua categoria. Além disso a resolução é das mais altas atualmente em circulação: 3200x1440 pixel. As funcionalidades oferecidas pelo Samsung Galaxy S20 Plus são muitas e todas top de linha. Começando pelo LTE 4G que permite a transferência de dados e excelente navegação na internet, além de conectividade Wi-fi e GPS presente no aparelho. Tem também leitor multimídia, vídeo conferência, e bluetooth. Enfatizamos a excelente memória interna de 128 GB com a possibilidade de expansão. Câmera de 12 megapixel. A espessura de apenas 7.8 milímetros torna o Samsung Galaxy S20 Plus um dos telefones mais finos que existem. === CARACTERÍSTICAS DO APARELHO: === --- DADOS DO FABRICANTE: . Marca: SAMSUNG; . Modelo: S20 PLUS. --- CHIP: . Quantidade Chip: 2 chips; . Tipo De Cartão SIM: Nano; --- TELA: . Tamanho: 6.7” (polegadas); . Tipo: Dynamic AMOLED. . Tela Infinita; . Touchscreen: Capacitiva Multitouch; . Resolução: 1440x3200 pixels. . Densidade de pixels: 525 ppi; . Cores: 16 milhões. --- PROCESSADOR: . Chipset: SAMSUNG Exynos 990. . GPU (placa gráfica): Mali-G77 MP11. . CPU (processador, núcleos): 2x 2.73 GHz Mongoose M5 + 2x 2.4 GHz Cortex-A76 + 4x 1.9 GHz Cortex-A55. --- MEMÓRIA: . Memória RAM: 8GB. . Memória Interna: 128GB (eMMC 5.1); . Memória expansível até 1000 microSD, microSDXC. (Cartão Não Incluso). --- SISTEMA OPERACIONAL: . Android 10. --- CÂMERAS: . Câmera Traseira: 12 Mp + 64 Mp + 12 Mp. . Aperture Size: F 1.8 + F 2 + F 2.2. . Estabilização: Digital; . Flash: LED (Traseira); . Detecção facial: Sim; . Câmera Frontal: 10MP (Aperture Size F 2.0); --- CONECTIVIDADE: . Bluetooth®: 5.0 com A2DP /LE/aptX; . Wi-Fi: 802.11 b/g/n (2.4Ghz); . Serviços de localização: A-GPS/GLONASS/BeiDou. . USB 3.1 Type C. . Entrada de fone de ouvido de 3.5 mm P2; . MP3; . Rádio (FM); . Alerta Vibratório; . Viva-voz; . Recursos de Chamadas: Chamada Inteligente; --- SENSORES: . Acelerômetro; . Sensor de proximidade; . Sensor de luminosidade; . Reconhecimento facial (desbloqueio); . Sensor de impressão digital (na traseira). --- BATERIA: . Tipo da bateria: LiPo; . Ampére da bateria: 4500 mAh; --- DIMENSÕES: . Aproximada do Produto: 161.9 x 73.7 x 7.8 mm; . Peso aproximado do Produto: 186 gramas. *********************************************************** ........ COMPRA CONSCIENTE E SEGURA: ........ *********************************************************** - O frete é oferecido pelo Mercado Livre e as opções estão disponíveis ao comprador, no ato da compra. - Decida com segurança ANTES da compra. Após, não tem como mudar. - A entrega será realizada apenas ao endereço que está em seu cadastro do Mercado Livre. - O produto é coletado em nossa empresa, de segunda a sexta, após às 12h, pela empresa (Correios ou Transportadora) CONTRATADA pelo Mercado Livre. - Em geral, até o dia útil seguinte, o Mercado Livre informa o código de rastreamento para acompanhamento da entrega do produto. - Após a coleta, a nossa empresa não tem qualquer forma de acesso ao processo de entrega do produto. - Se houver extravio, o Mercado Livre indeniza comprador e vendedor. - Ao receber o produto, NÃO ACEITE SE A EMBALAGEM ESTIVER VIOLADA. - Nossas embalagens são protegidas com saco plástico e fita invioláveis. - E se o produto apresentar algum problema, NÃO ABRA RECLAMAÇÃO NO MERCADO LIVRE!!! --- Envie-nos uma mensagem pelo Mercado Livre que rapidamente resolveremos o seu problema. - O horário de atendimento de nossa empresa é de segunda a sexta-feira, das 09h às 18h. Não temos expediente aos sábados, domingos e feriados. Agradecemos a preferência e ficamos à disposição. K2X !!!",Sim,1,Março,2020,MicroSD,1 TB,,,19.5 - 9,,Mali-G77 MP11,,,,One UI 2,Não,,Não,Não,Não,3x,Sim,Desbloqueado,,,,,,,,,,,,,
0,Moto E6s (2020) Dual Sim 64 Gb Vermelho-magenta 4 Gb Ram,https://produto.mercadolivre.com.br/MLB-1811366213-iphone-8-plus-64-gb-prata-impecavel-_JM,Motorola,Moto E,E6s (2020) Dual SIM,,64 GB,4 GB,"6.1 """,720 px x 1560 px,IPS,282 ppi,500 cd/m²,Sim,3000 mAh,Polímero de lítio,Não,Sim,,,Sim,,155.6 mm x 73 mm x 8.5 mm,Não,Sim,Não,Não,Sim,IP67,MediaTek MT6762 Helio P22,8x2 GHz Cortex-A53,8,2 GHz,Sim,Sim,,Não,Não,Sim,2,Nano-SIM,Não,160 g,Android,9.0 Pie,,13 Mpx,1920 px x 1080 px,5 Mpx,Sim,2,13 Mpx/2 Mpx,f 2.2/f 2.4,1,1920 px x 1080 px,f 2.2,Não,,,4G/LTE,Micro USB,Sim,Sim,Sim,Sim,Sim,Não,Não,Sim,Não,"Inteligente e preditivo O Motorola E6s (2020) Dual SIM tem o sistema operacional avançado Android9.0 Pie que aprende seus hábitos para se adaptar à sua rotina e alcançar a máxima eficiência de sua equipe. Essa tecnologia torna seu dispositivo tão autônomo que pode reduzir o consumo de energia, ajustar automaticamente o brilho e gerenciar a bateria de forma inteligente. Câmera dupla e mais detalhes Suas 2 câmeras traseiras de 13 Mpx/2 Mpx permitirão que você tire fotos mais detalhadas e obtenha efeitos únicos, como a famosa profundidade rasa do modo retrato de campo. Além disso, o dispositivo possui uma câmera frontal de 5 Mpx para que você possa tirar selfies divertidas ou fazer videochamadas. Mais para ver Com sua tela IPS de 6.1 "", desfrute de cores intensas e maior clareza em todo o seu conteúdo. Desbloqueio rápido com sua impressão digital Com o sensor de impressão digital, o acesso é seguro e você poderá desbloqueá-lo automaticamente com um toque. Bateria o dia todo Sua bateria 3000 mAh se adapta ao seu estilo de vida e lhe garante energia durante um dia inteiro com uma única carga. Grande capacidade de armazenamento Com sua memória interna de 64 GB você sempre terá espaço para armazenar arquivos e documentos importantes. Além disso, você poderá salvar filmes, séries e vídeos para reproduzi-los sempre que quiser offline.",Sim,,,2020,MicroSD,256 GB,,,,,IMG GE8320,650 MHz,,,,Não,,,Não,,,Sim,Desbloqueado,,,,,,,,,,,,,
0,iPhone 11 Pro 256gb,https://produto.mercadolivre.com.br/MLB-1811366213-iphone-8-plus-64-gb-prata-impecavel-_JM,Apple,iPhone,iPhone 11 Pro,,256 GB,4 GB,"5.8 """,1125 px x 2436 px,OLED,458 ppi,1200 cd/m²,Sim,3190 mAh,Íon de lítio,Sim,Não,,,Não,Sim,144 mm x 71.4 mm x 8.1 mm,Não,Sim,Sim,Não,Sim,IP68,Apple A13 Bionic,"2x2.65 GHz Lightning,4x1.8 GHz Thunder",6,2.65 GHz,Sim,Sim,Sim,Sim,Sim,Não,1,Nano-SIM,Sim,188 g,iOS,13,14,12 Mpx,3840 px x 2160 px,12 Mpx,Sim,3,12 Mpx/12 Mpx/12 Mpx,f 1.8/f 2.0/f 2.4,1,3840 px x 2160 px,f 2.2,Não,2x,10x,4G/LTE,Lightning,Não,Não,Sim,Sim,Sim,Sim,Não,Não,Não,Celular funcionando 100% porem com tela riscada no canto inferior. Nao atrapalha em nada e as cameras e icloud esta ok. Vem com capinha de cuoro original apple.,Não,1,Setembro,2019,,,Full HD+,,19.5 - 9,,Apple GPU,,,Sim,,,,,,,,Sim,Desbloqueado,,,,,,,,,,,,,
